{"schema_version":"1.0.0","source_id":"xhs-video","source_ref":"crp://sources/xhs-video","platform":"ignored-by-adapter","input_identity":"xhs share text video","resolver_revision":"fixture-1","normalizer_revision":"fixture-1","content_kind":"video","body":null,"metadata":{"note_type":"video"},"permission":{"decision":"granted","evidence_refs":["crp://evidence/xhs-permission"]},"provenance_refs":["crp://provenance/xhs-video"],"assets":[{"asset_id":"video-1","ordinal":0,"kind":"video","media_type":"video/mp4","role":"primary","locator":"fixture://xhs/video-1","source_ref":"crp://sources/xhs-video/assets/video-1","relations":[],"evidence_refs":["crp://evidence/xhs-video"]}]}
