{"schema_version":"1.0.0","source_id":"xhs-unknown","source_ref":"crp://sources/xhs-unknown","platform":"ignored-by-adapter","input_identity":"local opaque input","resolver_revision":"fixture-1","normalizer_revision":"fixture-1","content_kind":"unknown","body":null,"metadata":{"note_type":"unknown"},"permission":{"decision":"unknown","evidence_refs":["crp://evidence/xhs-unknown-permission"]},"provenance_refs":["crp://provenance/xhs-unknown"],"assets":[{"asset_id":"opaque-1","ordinal":0,"kind":"unknown","media_type":null,"role":"opaque","locator":null,"source_ref":"crp://sources/xhs-unknown/assets/opaque-1","relations":[],"evidence_refs":["crp://evidence/xhs-unknown"]}]}
