{"schema_version":"1.0.0","source_id":"bili-1","source_ref":"crp://sources/bili-1","platform":"ignored-by-adapter","input_identity":"https://www.bilibili.com/video/BV1xx411c7mD","resolver_revision":"fixture-1","normalizer_revision":"fixture-1","content_kind":"video","body":null,"metadata":{"title":"fixture"},"permission":{"decision":"granted","evidence_refs":["crp://evidence/bili-permission"]},"provenance_refs":["crp://provenance/bili"],"assets":[{"asset_id":"video-1","ordinal":0,"kind":"video","media_type":"video/mp4","role":"primary","locator":"fixture://bili/video-1","source_ref":"crp://sources/bili-1/assets/video-1","relations":[],"evidence_refs":["crp://evidence/bili-cid"]}]}
