{"schema_version":"1.0.0","source_id":"xhs-mixed","source_ref":"crp://sources/xhs-mixed","platform":"ignored-by-adapter","input_identity":"xhs share text mixed","resolver_revision":"fixture-1","normalizer_revision":"fixture-1","content_kind":"mixed","body":{"kind":"text","text":"fixture caption","source_ref":null},"metadata":{"note_type":"mixed"},"permission":{"decision":"granted","evidence_refs":["crp://evidence/xhs-permission"]},"provenance_refs":["crp://provenance/xhs-mixed"],"assets":[{"asset_id":"image-1","ordinal":0,"kind":"image","media_type":"image/jpeg","role":"cover","locator":"fixture://xhs/image-1","source_ref":"crp://sources/xhs-mixed/assets/image-1","relations":[{"relation":"illustrates","target_asset_id":"video-1"}],"evidence_refs":["crp://evidence/xhs-mixed-image"]},{"asset_id":"video-1","ordinal":1,"kind":"video","media_type":"video/mp4","role":"primary","locator":"fixture://xhs/video-1","source_ref":"crp://sources/xhs-mixed/assets/video-1","relations":[{"relation":"continues","target_asset_id":"text-1"}],"evidence_refs":["crp://evidence/xhs-mixed-video"]},{"asset_id":"text-1","ordinal":2,"kind":"text","media_type":"text/plain","role":"caption","locator":null,"source_ref":"crp://sources/xhs-mixed/assets/text-1","relations":[],"evidence_refs":["crp://evidence/xhs-mixed-caption"]}]}
