{"schema_version":"1.0.0","source_id":"xhs-images","source_ref":"crp://sources/xhs-images","platform":"ignored-by-adapter","input_identity":"xhs share text images","resolver_revision":"fixture-1","normalizer_revision":"fixture-1","content_kind":"image_set","body":{"kind":"text","text":"fixture caption","source_ref":null},"metadata":{"note_type":"image"},"permission":{"decision":"granted","evidence_refs":["crp://evidence/xhs-permission"]},"provenance_refs":["crp://provenance/xhs-images"],"assets":[{"asset_id":"image-1","ordinal":0,"kind":"image","media_type":"image/jpeg","role":"gallery","locator":"fixture://xhs/image-1","source_ref":"crp://sources/xhs-images/assets/image-1","relations":[{"relation":"next","target_asset_id":"image-2"}],"evidence_refs":["crp://evidence/xhs-images-1"]},{"asset_id":"image-2","ordinal":1,"kind":"image","media_type":"image/jpeg","role":"gallery","locator":"fixture://xhs/image-2","source_ref":"crp://sources/xhs-images/assets/image-2","relations":[{"relation":"previous","target_asset_id":"image-1"}],"evidence_refs":["crp://evidence/xhs-images-2"]}]}
